,"I work 2215-0645, eat at 1930 (with my family) 2330 and 0200. A sandwich, chips, cookies, yogurt and a fruit. I never really vary this. Also drink 2 liters of water from the time I get up, to the end of my shift. I take a fiber supplement, 1000iu vitamin d, and 250mg vitamin c. Get home by 0725 eat eggs with veggies. In bed by 0830, and try to sleep until 1530-1600. I've been doing this for 5 years now. That's always worked decently (I say decently because nothing is perfect on these overnights). In fact, lately, I feel wide awake all the time, not in a good way. Like when I used to get off worked I could barely keep my eyes open. Now I'm ready to go and do yard work, stay up with kids, read etc. Anyone experience this after 5+ years on overnights?"
,"I make sure I get 8-10 hrs of sleep a day.

Edit: day, not night."
,"I sleep from 830 am until 3 pm. I have an hour commute so I go immediately to bed, wear dark sunglasses for the ride. I take a melatonin 30 min into my ride home. I sleep for 6-7 hours and travel back one hour. On days off I arrive home and sleep about 4-5 hours and then go to bed later with my family so my routine is not off with the night time sleeping hours. 
I have been on this job for 5 years. My exercise and eating habits mirror many of the ones here, careful not to eat only a healthy snack at work. Caffeine is one cup when I wake up."
,"Stay away from fried food and sweets. Water only (no soda, even diet/caffeine free, no energy drinks) and exercise when you can"
,"Just flip your schedule around. Working nights doesn’t make you less healthy…? I still get my 2 workouts in a day and my diet stays the same, it’s a bit weird eating dinner in the morning but it is what it is. Just flip your schedule around, if you have a healthy diet and habits then there shouldn’t be any problems with working nights, just some getting used to."
,Some of us don't have the luxury of seeing the light of day especially in the winter during work week. So there's that too. Vitamin d helps. You lose protein in your blood and shit and metabolism slows down. Im stuck inside from 8pm to 9am meaning I only see light of day driving to and from work
,"I sleep 7 hours a day. I go to bed within two hours of getting off work. I wear blue light blocking glasses upon leaving work in order for my body to produce natural melatonin so that I will get good quality sleep and fall asleep naturally. I also do OMAD (one meal a day) and I don't eat anytime after 8pm. The later into the evening you eat, the more trouble your body has digesting that food and spiking your blood sugar levels. I also do a keto type diet with very low carb and sugar intake. Night shift affects the bodies ability to process sugars and carbs. Can lead to higher blood sugar and cause issues with insulin resistance. Right now, I am at the healthiest I've ever been in my life. On day shift I was overweight and low energy and living on caffeine. I am none of those things now."
,"I've done various things... so I work 10 PM - 8 AM.  I used to go on a bike ride for an hour during my lunch break but biking at night isn't very interesting... so I switched to taking walks  in our local state forest for an hour (it's like 10 min from my house) after work.  I've been slacking on the weekend bike rides though.

I sleep from about 12 noon until 9 PM or so.  Working from home and not having to commute an hour to and an hour from work has helped."
,"I Work from 9:30 to 7:30 I sleep from 8-4 I walk 4km 90% of days by Walking on my breaks at work and walking in the evening before work. I work from home and my street is a 390m loop so I do 10 loops and get 3.9k   


I've been on night shift for 11 years now and its WONDERFUL... BEST THING I EVER CHOSE TO DO!!"
,Only eat 2 nutri grain bars during my shift. Then 2 more for the ride home and a protien shake. Then wake up and drink a shake a have a bar. Go to the gym. Eat dinner. Repeat
,5-10 min walk every hour
,I take a really good multivitamin at the beginning of my shift. I take an organic food based one from Rainbow Light.
,"What's the brand multivitamin you use? I want to start taking them regularly, but theres a million to choose from"
,Rainbow Light. You can find them on Amazon
,"I work 11pm-7am. Before work at 7pm I work out, then I cook dinner after to eat before work and to also have a meal for lunch. After work I cook breakfast then sleep like a baby."
,Keep a consistent sleep schedule. Exercise and eat healthy. Same things you should do if you were day shift. But you must make them way more of a priority because night shift is already hard on the body.
,"I can't sleep as soon as I go home. I have to unwind and do stuff. I get all my chores and shopping done in the morning. I'll usually workout as soon as I get off or go for a bike ride then do the other stuff eat. Relax by watching a movie or a show then go to bed by about 10am usually. 

I work 7:15p.m to 4-6am depending on overtime and such"
,Stay healthy? 😓
,Y’all are healthy???
,"It's the same as working days, but at different times?"
,"If I fall into a 'day schedule' on my weekends...I always go for a nap Saturday night until 12am-1a. Then stay up all night to sleep for Sunday night shift. 

Typically sleep 1pm - 9pm give or take an hour or 2. (I work 11-7)"
,Swing shifts should be illegal or have way more pay and time off imo. Good luck.
,Agreed but just one night at least!
,Quit that job if you value your life.
,"After your 7am-3pm shift, try to stay awake as long as possible, ideally until around 8 or 9pm. Then take a short nap (3-4 hours). Wake up around midnight or 1am and stay awake until after your night shift ends at 7am. This will help reset your internal clock more quickly. After your night shift, head home, create a dark and quiet sleeping environment, and aim to sleep as long as your body will let you, ideally until around 3 or 4pm. This will set you up better for the subsequent night shifts. Everyone's body reacts differently, so listen to your body and adjust as needed."
,Thank you!!! That sounds like a good plan. I was thinking of trying something like that. :)
,One nap at a time. This is the way (of the nightshifter)
,"It”s one dayshift for orientation. I understand that. I work in the medical field. My go to every single day/night routine is Unisom to sleep, Rainbow Light organic multivitamin and coffee to be awake.  I cannot sleep without a sleep aid. I have screwed up my circadian rhythm so bad with my years and years shift work. It’s the only thing that works for me."
,Thankyou :) I’m also in the medical field. Ill look into those!
,"When I pick up my Unisom, look for the one with the active ingredient Doxycycline Succinate. Not the one with the same active ingredient as Benadryl. That gives me a hangover when I wake up and takes too long to shake off."
,you don't.
,"A few supplements you can take an hour before bed that are helpful are Glycine, magnesium l-threonate and Apigenin."
,I will try them.  Thx
,"I think you’re fully acclimated to night shift now. If you’ve been changing your schedule on the weekends, you never really got into a real sleep rhythm, and slowly but surely, you eventually did anyways. I work very similar hours as your and used to change my weekend hours by 4 hours so I could be up and at it by noon, but now I can’t really do that anymore, I can’t fall asleep for shit that early now. 

Anyways, that’s totally a guess as to why you can’t sleep. I can’t even change mine by a few hours anymore."
,Edit: my shift hours are 21:30-07:30
,"Could it be the change of the seasons and the sun setting earlier? Because I remember having trouble getting sleep this time last year and I’m dealing with it again. Going on like 3 weeks. I’ll go to bed around 10 and no matter what I’m waking up around 2-3pm. I also suspect my place is low on humidity now that I’ve gotta fire up the furnace and drying the place up. 

But I don’t do what you do regarding the days off, I keep the same sleep schedule all week. Maybe you’re just getting old"
,😂 maybe I am
